{
  "schema_version": "1.0",
  "source": {
    "source_id": "bilibili-BV1Sv421k7pS",
    "url": "https://www.bilibili.com/video/BV1Sv421k7pS/"
  },
  "generated_at": "2026-08-15T07:15:32.285619+00:00",
  "configuration": {
    "scene_threshold": 0.22,
    "visual_fps": 2.0,
    "audio_window_sec": 0.5,
    "asr_provider": "faster-whisper",
    "asr_model": "small",
    "language": "zh"
  },
  "media": {
    "duration_sec": 1370.67,
    "size_bytes": 31604121,
    "streams": [
      {
        "index": 0,
        "codec_type": "video",
        "width": 640,
        "height": 360
      },
      {
        "index": 1,
        "codec_type": "audio"
      }
    ],
    "shot_count": 116,
    "median_shot_duration_sec": 7.591,
    "p75_shot_duration_sec": 13.414,
    "shots_under_1_sec": 2,
    "shots_over_5_sec": 85,
    "silent_ratio": 0.0062,
    "audio_kind_ratios": {
      "ambient_likely": 0.1083,
      "music_likely": 0.0259,
      "silence": 0.0047,
      "speech": 0.8613
    },
    "opening_15_sec": {
      "shot_count": 4,
      "average_shot_duration_sec": 4.112
    }
  },
  "transcription": {
    "status": "ready",
    "provider": "faster-whisper",
    "model": "small",
    "language": "zh",
    "language_probability": 1.0,
    "duration_sec": 1370.667,
    "segment_count": 987,
    "word_count": 4424,
    "segments": [],
    "words": [],
    "portable_redaction": "完整逐字稿仅保存在本地分析目录。"
  },
  "audio_segments": [
    {
      "start_sec": 0.0,
      "end_sec": 42.0,
      "kind": "speech",
      "average_rms": 0.13343,
      "peak": 0.952698
    },
    {
      "start_sec": 42.0,
      "end_sec": 43.5,
      "kind": "ambient_likely",
      "average_rms": 0.130229,
      "peak": 0.832397
    },
    {
      "start_sec": 43.5,
      "end_sec": 58.0,
      "kind": "speech",
      "average_rms": 0.120583,
      "peak": 0.877747
    },
    {
      "start_sec": 58.0,
      "end_sec": 58.5,
      "kind": "music_likely",
      "average_rms": 0.13035,
      "peak": 0.579102
    },
    {
      "start_sec": 58.5,
      "end_sec": 70.0,
      "kind": "speech",
      "average_rms": 0.08089,
      "peak": 0.760315
    },
    {
      "start_sec": 70.0,
      "end_sec": 71.0,
      "kind": "ambient_likely",
      "average_rms": 0.090313,
      "peak": 0.683411
    },
    {
      "start_sec": 71.0,
      "end_sec": 78.5,
      "kind": "speech",
      "average_rms": 0.113766,
      "peak": 0.768372
    },
    {
      "start_sec": 78.5,
      "end_sec": 79.0,
      "kind": "ambient_likely",
      "average_rms": 0.14726,
      "peak": 0.663452
    },
    {
      "start_sec": 79.0,
      "end_sec": 85.5,
      "kind": "speech",
      "average_rms": 0.116096,
      "peak": 0.843384
    },
    {
      "start_sec": 85.5,
      "end_sec": 86.5,
      "kind": "ambient_likely",
      "average_rms": 0.027367,
      "peak": 0.141724
    },
    {
      "start_sec": 86.5,
      "end_sec": 92.0,
      "kind": "speech",
      "average_rms": 0.10104,
      "peak": 0.763
    },
    {
      "start_sec": 92.0,
      "end_sec": 92.5,
      "kind": "ambient_likely",
      "average_rms": 0.01604,
      "peak": 0.105835
    },
    {
      "start_sec": 92.5,
      "end_sec": 103.0,
      "kind": "speech",
      "average_rms": 0.128033,
      "peak": 0.960724
    },
    {
      "start_sec": 103.0,
      "end_sec": 103.5,
      "kind": "ambient_likely",
      "average_rms": 0.025559,
      "peak": 0.098999
    },
    {
      "start_sec": 103.5,
      "end_sec": 111.5,
      "kind": "speech",
      "average_rms": 0.155454,
      "peak": 0.999969
    },
    {
      "start_sec": 111.5,
      "end_sec": 112.0,
      "kind": "ambient_likely",
      "average_rms": 0.02802,
      "peak": 0.117249
    },
    {
      "start_sec": 112.0,
      "end_sec": 113.5,
      "kind": "speech",
      "average_rms": 0.162942,
      "peak": 0.925537
    },
    {
      "start_sec": 113.5,
      "end_sec": 114.0,
      "kind": "ambient_likely",
      "average_rms": 0.099298,
      "peak": 0.842041
    },
    {
      "start_sec": 114.0,
      "end_sec": 137.0,
      "kind": "speech",
      "average_rms": 0.138599,
      "peak": 0.923248
    },
    {
      "start_sec": 137.0,
      "end_sec": 137.5,
      "kind": "ambient_likely",
      "average_rms": 0.03736,
      "peak": 0.12677
    },
    {
      "start_sec": 137.5,
      "end_sec": 141.5,
      "kind": "speech",
      "average_rms": 0.154243,
      "peak": 0.900269
    },
    {
      "start_sec": 141.5,
      "end_sec": 142.0,
      "kind": "ambient_likely",
      "average_rms": 0.068891,
      "peak": 0.309296
    },
    {
      "start_sec": 142.0,
      "end_sec": 144.0,
      "kind": "speech",
      "average_rms": 0.113654,
      "peak": 0.685028
    },
    {
      "start_sec": 144.0,
      "end_sec": 145.0,
      "kind": "ambient_likely",
      "average_rms": 0.155234,
      "peak": 0.716095
    },
    {
      "start_sec": 145.0,
      "end_sec": 148.5,
      "kind": "speech",
      "average_rms": 0.203533,
      "peak": 0.976379
    },
    {
      "start_sec": 148.5,
      "end_sec": 149.0,
      "kind": "music_likely",
      "average_rms": 0.216086,
      "peak": 0.868378
    },
    {
      "start_sec": 149.0,
      "end_sec": 163.0,
      "kind": "speech",
      "average_rms": 0.132089,
      "peak": 0.957977
    },
    {
      "start_sec": 163.0,
      "end_sec": 163.5,
      "kind": "ambient_likely",
      "average_rms": 0.056625,
      "peak": 0.254303
    },
    {
      "start_sec": 163.5,
      "end_sec": 171.5,
      "kind": "speech",
      "average_rms": 0.144321,
      "peak": 0.999969
    },
    {
      "start_sec": 171.5,
      "end_sec": 172.5,
      "kind": "ambient_likely",
      "average_rms": 0.222639,
      "peak": 0.87616
    },
    {
      "start_sec": 172.5,
      "end_sec": 178.5,
      "kind": "speech",
      "average_rms": 0.242292,
      "peak": 0.914673
    },
    {
      "start_sec": 178.5,
      "end_sec": 179.0,
      "kind": "ambient_likely",
      "average_rms": 0.210362,
      "peak": 0.819855
    },
    {
      "start_sec": 179.0,
      "end_sec": 181.0,
      "kind": "speech",
      "average_rms": 0.174297,
      "peak": 0.849152
    },
    {
      "start_sec": 181.0,
      "end_sec": 182.0,
      "kind": "ambient_likely",
      "average_rms": 0.160185,
      "peak": 0.803192
    },
    {
      "start_sec": 182.0,
      "end_sec": 190.5,
      "kind": "speech",
      "average_rms": 0.141457,
      "peak": 0.919647
    },
    {
      "start_sec": 190.5,
      "end_sec": 191.5,
      "kind": "ambient_likely",
      "average_rms": 0.145203,
      "peak": 0.945648
    },
    {
      "start_sec": 191.5,
      "end_sec": 193.5,
      "kind": "speech",
      "average_rms": 0.101321,
      "peak": 0.719208
    },
    {
      "start_sec": 193.5,
      "end_sec": 195.0,
      "kind": "music_likely",
      "average_rms": 0.103717,
      "peak": 0.566223
    },
    {
      "start_sec": 195.0,
      "end_sec": 216.0,
      "kind": "speech",
      "average_rms": 0.126151,
      "peak": 0.865448
    },
    {
      "start_sec": 216.0,
      "end_sec": 217.0,
      "kind": "ambient_likely",
      "average_rms": 0.066574,
      "peak": 0.34906
    },
    {
      "start_sec": 217.0,
      "end_sec": 282.5,
      "kind": "speech",
      "average_rms": 0.114064,
      "peak": 0.976593
    },
    {
      "start_sec": 282.5,
      "end_sec": 283.0,
      "kind": "silence",
      "average_rms": 0.010137,
      "peak": 0.057129
    },
    {
      "start_sec": 283.0,
      "end_sec": 283.5,
      "kind": "music_likely",
      "average_rms": 0.176178,
      "peak": 0.633453
    },
    {
      "start_sec": 283.5,
      "end_sec": 285.0,
      "kind": "ambient_likely",
      "average_rms": 0.049289,
      "peak": 0.369629
    },
    {
      "start_sec": 285.0,
      "end_sec": 309.5,
      "kind": "speech",
      "average_rms": 0.140142,
      "peak": 0.966431
    },
    {
      "start_sec": 309.5,
      "end_sec": 310.5,
      "kind": "ambient_likely",
      "average_rms": 0.121294,
      "peak": 0.763489
    },
    {
      "start_sec": 310.5,
      "end_sec": 370.5,
      "kind": "speech",
      "average_rms": 0.13926,
      "peak": 1.0
    },
    {
      "start_sec": 370.5,
      "end_sec": 372.0,
      "kind": "ambient_likely",
      "average_rms": 0.175122,
      "peak": 0.974518
    },
    {
      "start_sec": 372.0,
      "end_sec": 394.0,
      "kind": "speech",
      "average_rms": 0.116944,
      "peak": 0.942383
    },
    {
      "start_sec": 394.0,
      "end_sec": 394.5,
      "kind": "ambient_likely",
      "average_rms": 0.063367,
      "peak": 0.601562
    },
    {
      "start_sec": 394.5,
      "end_sec": 402.0,
      "kind": "speech",
      "average_rms": 0.13706,
      "peak": 1.0
    },
    {
      "start_sec": 402.0,
      "end_sec": 403.0,
      "kind": "ambient_likely",
      "average_rms": 0.188061,
      "peak": 0.80835
    },
    {
      "start_sec": 403.0,
      "end_sec": 412.5,
      "kind": "speech",
      "average_rms": 0.134051,
      "peak": 0.999969
    },
    {
      "start_sec": 412.5,
      "end_sec": 413.0,
      "kind": "ambient_likely",
      "average_rms": 0.156976,
      "peak": 0.628143
    },
    {
      "start_sec": 413.0,
      "end_sec": 418.0,
      "kind": "speech",
      "average_rms": 0.166655,
      "peak": 0.824585
    },
    {
      "start_sec": 418.0,
      "end_sec": 418.5,
      "kind": "music_likely",
      "average_rms": 0.198571,
      "peak": 0.340485
    },
    {
      "start_sec": 418.5,
      "end_sec": 433.0,
      "kind": "speech",
      "average_rms": 0.110217,
      "peak": 0.880554
    },
    {
      "start_sec": 433.0,
      "end_sec": 433.5,
      "kind": "ambient_likely",
      "average_rms": 0.105759,
      "peak": 0.895233
    },
    {
      "start_sec": 433.5,
      "end_sec": 437.0,
      "kind": "speech",
      "average_rms": 0.114495,
      "peak": 0.961853
    },
    {
      "start_sec": 437.0,
      "end_sec": 437.5,